{
  "version": "1.0",
  "name": "binary-heart",
  "revision": 1,
  "mode": "indexed",
  "canvas": { "width": 16, "height": 16 },
  "palette_limit": 2,
  "allow_transparency": false,
  "palette": [
    { "index": 0, "hex": "#FFFFFF", "name": "background" },
    { "index": 1, "hex": "#000000", "name": "foreground" }
  ],
  "encoding": "matrix",
  "pixels": [
    "0000000000000000",
    "0001100000011000",
    "0011110000111100",
    "0111111001111110",
    "0111111111111110",
    "0111111111111110",
    "0011111111111100",
    "0001111111111000",
    "0000111111110000",
    "0000011111100000",
    "0000001111000000",
    "0000000110000000",
    "0000000000000000",
    "0000000000000000",
    "0000000000000000",
    "0000000000000000"
  ],
  "style": {
    "preset": "binary_icon",
    "silhouette_priority": "high",
    "outline": "none",
    "shading": "none",
    "dithering": "disabled",
    "symmetry": "approximate_vertical",
    "detail_level": "minimal",
    "edge_language": "intentional_steps",
    "negative_space": "clear",
    "isolated_pixels": "avoid",
    "visual_weight": "balanced"
  },
  "metadata": { "subject": "heart icon", "notes": "strict binary pixel art" }
}
